{
 "schema": 1,
 "pack": "family_parenting",
 "packKind": "knowledge",
 "topic": "family_parenting",
 "description": "Marriage, home life, parents and raising children, written from the Family Life school and the Huda guides in the app. Teaching material and prophetic examples, not counselling or a ruling for a particular case.",
 "audience": "hadi",
 "ageBands": ["all"],
 "version": "0.1.0",
 "createdOn": "2026-10-27",
 "reviewBy": "2027-04-27",
 "languages": ["en"],
 "snippets": [
  {
   "id": "family_parenting.fact.001",
   "kind": "fact",
   "stage": ["question"],
   "text": {
    "en": "In Islam marriage is a solemn promise before Allah, not just a celebration or a paper. The Qur'an says spouses are signs of calm, affection and mercy, and calls the marriage bond a solemn covenant."
   },
   "ageBand": ["adult"],
   "tags": ["family", "parenting", "marriage"],
   "triggers": ["purpose of marriage", "why marry", "what is marriage in islam", "marriage in islam"],
   "doNotSay": [],
   "sources": [
    {"type": "asset", "ref": "assets/academy/lessons_v3/family.json#fam.u1.l1"},
    {"type": "quran", "ref": "30:21", "section": "Qur'an text"},
    {"type": "quran", "ref": "4:21", "section": "Qur'an text"}
   ],
   "crossRef": [{"asset": "assets/academy/lessons_v3/family.json", "id": "fam.u1.l1"}],
   "evidenceLevel": "D",
   "risk": "low",
   "needsScholarReview": true,
   "needsClinicianReview": false,
   "needsNativeClinicianReview": false,
   "reviewedBy": null,
   "reviewedOn": null,
   "status": "draft"
  },
  {
   "id": "family_parenting.fact.002",
   "kind": "fact",
   "stage": ["question"],
   "text": {
    "en": "Islam encourages marriage and does not ask believers to give up family life in order to worship more. The Prophet told young people who can marry to marry, since it helps them lower the gaze and guard their modesty."
   },
   "ageBand": ["adult"],
   "tags": ["family", "parenting", "marriage"],
   "triggers": ["should i marry", "encouraged to marry", "celibacy in islam"],
   "doNotSay": [],
   "sources": [
    {"type": "asset", "ref": "assets/academy/lessons_v3/family.json#fam.u1.l1"},
    {"type": "hadith", "ref": "bukhari:5066", "grade": "Sahih", "grader": "two Sahihs", "section": "RES_H2 knowledge"},
    {"type": "hadith", "ref": "bukhari:5063", "grade": "Sahih", "grader": "two Sahihs", "section": "RES_H2 knowledge"},
    {"type": "quran", "ref": "24:32", "section": "Qur'an text"}
   ],
   "crossRef": [{"asset": "assets/academy/lessons_v3/family.json", "id": "fam.u1.l1"}, {"asset": "assets/guides/guides.json", "id": "huda-nikah"}],
   "evidenceLevel": "D",
   "risk": "low",
   "needsScholarReview": true,
   "needsClinicianReview": false,
   "needsNativeClinicianReview": false,
   "reviewedBy": null,
   "reviewedOn": null,
   "status": "draft"
  },
  {
   "id": "family_parenting.fact.003",
   "kind": "fact",
   "stage": ["question"],
   "text": {
    "en": "Consent matters in marriage. The Prophet said a previously married woman should not be married without being consulted, and a woman who has not been married should not be married without her permission, which her silence can show."
   },
   "ageBand": ["adult"],
   "tags": ["family", "parenting", "marriage", "consent"],
   "triggers": ["forced marriage", "consent in marriage", "does a woman have to agree"],
   "doNotSay": ["If a person describes being forced into marriage or fearing it, move to the support pack and helplines; never counsel obedience."],
   "sources": [
    {"type": "asset", "ref": "assets/guides/guides.json#huda-nikah"},
    {"type": "hadith", "ref": "bukhari:5136", "grade": "Sahih", "grader": "two Sahihs", "section": "RES_H2 knowledge"}
   ],
   "crossRef": [{"asset": "assets/guides/guides.json", "id": "huda-nikah"}],
   "evidenceLevel": "D",
   "risk": "low",
   "needsScholarReview": true,
   "needsClinicianReview": false,
   "needsNativeClinicianReview": false,
   "reviewedBy": null,
   "reviewedOn": null,
   "status": "draft"
  },
  {
   "id": "family_parenting.fact.004",
   "kind": "fact",
   "stage": ["question"],
   "text": {
    "en": "The mahr is the bride's right, and even something small can be a mahr. The Prophet told a man to look for something, even an iron ring. A wedding feast, the walimah, is encouraged, even if simple."
   },
   "ageBand": ["adult"],
   "tags": ["family", "parenting", "marriage", "mahr"],
   "triggers": ["mahr", "dowry", "walimah", "wedding feast"],
   "doNotSay": [],
   "sources": [
    {"type": "asset", "ref": "assets/guides/guides.json#huda-nikah"},
    {"type": "quran", "ref": "4:4", "section": "Qur'an text"},
    {"type": "hadith", "ref": "bukhari:5167", "grade": "Sahih", "grader": "two Sahihs", "section": "RES_H2 knowledge"}
   ],
   "crossRef": [{"asset": "assets/guides/guides.json", "id": "huda-nikah"}],
   "evidenceLevel": "D",
   "risk": "low",
   "needsScholarReview": true,
   "needsClinicianReview": false,
   "needsNativeClinicianReview": false,
   "reviewedBy": null,
   "reviewedOn": null,
   "status": "draft"
  },
  {
   "id": "family_parenting.fact.005",
   "kind": "fact",
   "stage": ["question"],
   "text": {
    "en": "The role of the guardian in the marriage contract differs by school. Scholars differ: the Maliki, Shafi'i and Hanbali schools say the contract is not valid without a guardian, while the Hanafi school lets an adult woman contract her own marriage, though the guardian may object in some cases."
   },
   "ageBand": ["adult"],
   "tags": ["family", "parenting", "marriage", "madhhab", "wali"],
   "triggers": ["wali", "guardian in marriage", "can a woman marry herself"],
   "doNotSay": [],
   "sources": [
    {"type": "asset", "ref": "assets/guides/guides.json#huda-nikah"}
   ],
   "crossRef": [{"asset": "assets/guides/guides.json", "id": "huda-nikah"}],
   "evidenceLevel": "N",
   "risk": "low",
   "disputed": true,
   "schoolsNamed": ["hanafi", "maliki", "shafii", "hanbali"],
   "needsScholarReview": true,
   "needsClinicianReview": false,
   "needsNativeClinicianReview": false,
   "reviewedBy": null,
   "reviewedOn": null,
   "status": "draft"
  },
  {
   "id": "family_parenting.fact.006",
   "kind": "fact",
   "stage": ["question"],
   "text": {
    "en": "The best of you is the one who is best to his family. The Prophet said it and added that he was the best of them to his family. This is a measure of goodness that cannot be faked, because family sees you when you are not performing."
   },
   "ageBand": ["adult"],
   "tags": ["family", "parenting", "marriage", "character"],
   "triggers": ["best to his family", "treat family well", "be good to my wife"],
   "doNotSay": [],
   "sources": [
    {"type": "asset", "ref": "assets/academy/lessons_v3/family.json#fam.u1.l2"},
    {"type": "hadith", "ref": "tirmidhi:3895", "grade": "Hasan (Zubair Ali Zai); Sahih (Al-Albani, Ahmad Muhammad Shakir); Hasan Sahih (Bashar Awad Maarouf)", "grader": "Darussalam (Zubair Ali Zai) and al-Albani as listed; read in the fawazahmed0/hadith-api corpus", "section": "RES_H2 knowledge"}
   ],
   "crossRef": [{"asset": "assets/academy/lessons_v3/family.json", "id": "fam.u1.l2"}],
   "evidenceLevel": "D",
   "risk": "low",
   "needsScholarReview": true,
   "needsClinicianReview": false,
   "needsNativeClinicianReview": false,
   "reviewedBy": null,
   "reviewedOn": null,
   "status": "draft"
  },
  {
   "id": "family_parenting.fact.007",
   "kind": "fact",
   "stage": ["question"],
   "text": {
    "en": "The Prophet was playful and attentive at home. He once raced Aisha on foot, and he noticed her moods and said so kindly. A good home has laughter and attention in it."
   },
   "ageBand": ["adult"],
   "tags": ["family", "parenting", "marriage", "sunnah"],
   "triggers": ["prophet with his wife", "romance in islam", "play with spouse"],
   "doNotSay": [],
   "sources": [
    {"type": "asset", "ref": "assets/academy/lessons_v3/family.json#fam.u1.l2"},
    {"type": "hadith", "ref": "abudawud:2578", "grade": "sahih", "grader": "al-Albani", "section": "RES_H2 knowledge"},
    {"type": "hadith", "ref": "bukhari:5228", "grade": "Sahih", "grader": "two Sahihs", "section": "RES_H2 knowledge"}
   ],
   "crossRef": [{"asset": "assets/academy/lessons_v3/family.json", "id": "fam.u1.l2"}],
   "evidenceLevel": "D",
   "risk": "low",
   "needsScholarReview": true,
   "needsClinicianReview": false,
   "needsNativeClinicianReview": false,
   "reviewedBy": null,
   "reviewedOn": null,
   "status": "draft"
  },
  {
   "id": "family_parenting.fact.008",
   "kind": "fact",
   "stage": ["question"],
   "text": {
    "en": "The Prophet never struck anyone with his hand, neither a woman nor a servant. He also told people who quarrel to avoid the face. Harsh treatment at home has no support in his example."
   },
   "ageBand": ["adult"],
   "tags": ["family", "parenting", "marriage", "safety"],
   "triggers": ["hitting wife", "is it allowed to hit", "violence at home"],
   "doNotSay": ["If someone is being hurt, move to the domestic abuse support pack; never quote or interpret 4:34."],
   "sources": [
    {"type": "asset", "ref": "assets/academy/lessons_v3/family.json#fam.u1.l2"},
    {"type": "hadith", "ref": "muslim:2328", "grade": "Sahih", "grader": "two Sahihs", "section": "RES_H2 knowledge"},
    {"type": "hadith", "ref": "muslim:2612", "grade": "Sahih", "grader": "two Sahihs", "section": "RES_H2 knowledge"}
   ],
   "crossRef": [{"asset": "assets/academy/lessons_v3/family.json", "id": "fam.u1.l2"}],
   "evidenceLevel": "D",
   "risk": "medium",
   "needsScholarReview": true,
   "needsClinicianReview": true,
   "needsNativeClinicianReview": false,
   "reviewedBy": null,
   "reviewedOn": null,
   "status": "draft"
  },
  {
   "id": "family_parenting.fact.009",
   "kind": "fact",
   "stage": ["question"],
   "text": {